"No.","Time","Source","Destination","Protocol","Length","Info"
"1","0.000000","202.77.162.213","172.16.115.20","Portmap","98","V2 GETPORT Call (Reply In 2) SADMIND(100232) V:10 UDP"
"2","0.001303","172.16.115.20","202.77.162.213","Portmap","70","V2 GETPORT Reply (Call In 1) Port:32773"
"3","0.009817","202.77.162.213","172.16.115.20","SADMIND","1454","V10 proc-1 Call"
"4","2.031346","202.77.162.213","172.16.115.20","Portmap","98","V2 GETPORT Call (Reply In 5) SADMIND(100232) V:10 UDP"
"5","2.032605","172.16.115.20","202.77.162.213","Portmap","70","V2 GETPORT Reply (Call In 4) Port:32773"
"6","2.041075","202.77.162.213","172.16.115.20","SADMIND","1454","V10 proc-1 Call"
"7","4.047754","202.77.162.213","172.16.115.20","TCP","74","46956  >  23 [SYN] Seq=0 Win=32768 Len=0 MSS=1460 WS=1 TSval=184573 TSecr=0"
"8","4.048043","172.16.115.20","202.77.162.213","TCP","74","23  >  46956 [SYN, ACK] Seq=0 Ack=1 Win=10136 Len=0 TSval=9111864 TSecr=184573 WS=1 MSS=1460"
"9","4.048199","202.77.162.213","172.16.115.20","TCP","66","46956  >  23 [ACK] Seq=1 Ack=1 Win=33580 Len=0 TSval=184573 TSecr=9111864"
"10","4.117136","172.16.115.20","202.77.162.213","TELNET","81","Telnet Data ..."
"11","4.120574","202.77.162.213","172.16.115.20","TELNET","81","Telnet Data ..."
"12","4.120775","172.16.115.20","202.77.162.213","TCP","66","23  >  46956 [ACK] Seq=16 Ack=16 Win=10136 Len=0 TSval=9111872 TSecr=184573"
"13","4.123566","172.16.115.20","202.77.162.213","TELNET","102","Telnet Data ..."
"14","4.137586","202.77.162.213","172.16.115.20","TCP","66","46956  >  23 [ACK] Seq=16 Ack=52 Win=33580 Len=0 TSval=184573 TSecr=9111872"
"15","4.174234","172.16.115.20","202.77.162.213","TELNET","75","Telnet Data ..."
"16","4.176816","202.77.162.213","172.16.115.20","TELNET","75","Telnet Data ..."
"17","4.177075","172.16.115.20","202.77.162.213","TELNET","73","Telnet Data ..."
"18","4.179238","202.77.162.213","172.16.115.20","TELNET","75","Telnet Data ..."
"19","4.179441","172.16.115.20","202.77.162.213","TELNET","69","Telnet Data ..."
"20","4.192953","202.77.162.213","172.16.115.20","TCP","66","46956  >  23 [ACK] Seq=34 Ack=71 Win=33577 Len=0 TSval=184573 TSecr=9111878"
"21","4.193161","172.16.115.20","202.77.162.213","TELNET","85","Telnet Data ..."
"22","4.197635","202.77.162.213","172.16.115.20","TCP","66","46956  >  23 [ACK] Seq=34 Ack=90 Win=33561 Len=0 TSval=184573 TSecr=9111879"
"23","4.199551","202.77.162.213","172.16.115.20","TELNET","75","Telnet Data ..."
"24","4.200350","172.16.115.20","202.77.162.213","TELNET","68","Telnet Data ..."
"25","4.217611","202.77.162.213","172.16.115.20","TCP","66","46956  >  23 [ACK] Seq=43 Ack=92 Win=33580 Len=0 TSval=184573 TSecr=9111880"
"26","8.219323","172.16.115.20","202.77.162.213","TELNET","83","Telnet Data ..."
"27","8.237677","202.77.162.213","172.16.115.20","TCP","66","46956  >  23 [ACK] Seq=43 Ack=109 Win=33580 Len=0 TSval=184582 TSecr=9112282"
"28","8.237867","172.16.115.20","202.77.162.213","TELNET","73","Telnet Data ..."
"29","8.257698","202.77.162.213","172.16.115.20","TCP","66","46956  >  23 [ACK] Seq=43 Ack=116 Win=33580 Len=0 TSval=184582 TSecr=9112283"
"30","8.264276","202.77.162.213","172.16.115.20","Portmap","98","V2 GETPORT Call (Reply In 31) SADMIND(100232) V:10 UDP"
"31","8.265531","172.16.115.20","202.77.162.213","Portmap","70","V2 GETPORT Reply (Call In 30) Port:32773"
"32","8.274039","202.77.162.213","172.16.115.20","SADMIND","1454","V10 proc-1 Call"
"33","10.301745","202.77.162.213","172.16.115.20","Portmap","98","V2 GETPORT Call (Reply In 34) SADMIND(100232) V:10 UDP"
"34","10.303019","172.16.115.20","202.77.162.213","Portmap","70","V2 GETPORT Reply (Call In 33) Port:32773"
"35","10.311427","202.77.162.213","172.16.115.20","SADMIND","1454","V10 proc-1 Call"
"36","12.312634","202.77.162.213","172.16.115.20","TCP","66","46956  >  23 [FIN, ACK] Seq=43 Ack=116 Win=33580 Len=0 TSval=184590 TSecr=9112283"
"37","12.312816","172.16.115.20","202.77.162.213","TCP","66","23  >  46956 [ACK] Seq=116 Ack=44 Win=10136 Len=0 TSval=9112691 TSecr=184590"
"38","12.317512","202.77.162.213","172.16.115.20","TCP","74","46958  >  23 [SYN] Seq=0 Win=32768 Len=0 MSS=1460 WS=1 TSval=184590 TSecr=0"
"39","12.317813","172.16.115.20","202.77.162.213","TCP","74","23  >  46958 [SYN, ACK] Seq=0 Ack=1 Win=10136 Len=0 TSval=9112691 TSecr=184590 WS=1 MSS=1460"
"40","12.317965","202.77.162.213","172.16.115.20","TCP","66","46958  >  23 [ACK] Seq=1 Ack=1 Win=33580 Len=0 TSval=184590 TSecr=9112691"
"41","12.369466","172.16.115.20","202.77.162.213","TCP","66","23  >  46956 [FIN, ACK] Seq=116 Ack=44 Win=10136 Len=0 TSval=9112697 TSecr=184590"
"42","12.369610","202.77.162.213","172.16.115.20","TCP","66","46956  >  23 [ACK] Seq=44 Ack=117 Win=33580 Len=0 TSval=184590 TSecr=9112697"
"43","12.400280","172.16.115.20","202.77.162.213","TELNET","81","Telnet Data ..."
"44","12.403435","202.77.162.213","172.16.115.20","TELNET","81","Telnet Data ..."
"45","12.403635","172.16.115.20","202.77.162.213","TCP","66","23  >  46958 [ACK] Seq=16 Ack=16 Win=10136 Len=0 TSval=9112700 TSecr=184590"
"46","12.406388","172.16.115.20","202.77.162.213","TELNET","102","Telnet Data ..."
"47","12.427624","202.77.162.213","172.16.115.20","TCP","66","46958  >  23 [ACK] Seq=16 Ack=52 Win=33580 Len=0 TSval=184590 TSecr=9112700"
"48","12.457734","172.16.115.20","202.77.162.213","TELNET","75","Telnet Data ..."
"49","12.460237","202.77.162.213","172.16.115.20","TELNET","75","Telnet Data ..."
"50","12.460487","172.16.115.20","202.77.162.213","TELNET","73","Telnet Data ..."
"51","12.462590","202.77.162.213","172.16.115.20","TELNET","75","Telnet Data ..."
"52","12.462792","172.16.115.20","202.77.162.213","TELNET","69","Telnet Data ..."
"53","12.477607","202.77.162.213","172.16.115.20","TCP","66","46958  >  23 [ACK] Seq=34 Ack=71 Win=33580 Len=0 TSval=184590 TSecr=9112706"
"54","12.477809","172.16.115.20","202.77.162.213","TELNET","85","Telnet Data ..."
"55","12.479833","202.77.162.213","172.16.115.20","TELNET","75","Telnet Data ..."
"56","12.480616","172.16.115.20","202.77.162.213","TELNET","68","Telnet Data ..."
"57","12.497602","202.77.162.213","172.16.115.20","TCP","66","46958  >  23 [ACK] Seq=43 Ack=92 Win=33580 Len=0 TSval=184590 TSecr=9112708"
"58","16.499491","172.16.115.20","202.77.162.213","TELNET","83","Telnet Data ..."
"59","16.517666","202.77.162.213","172.16.115.20","TCP","66","46958  >  23 [ACK] Seq=43 Ack=109 Win=33580 Len=0 TSval=184598 TSecr=9113110"
"60","16.517876","172.16.115.20","202.77.162.213","TELNET","73","Telnet Data ..."
"61","16.537802","202.77.162.213","172.16.115.20","TCP","66","46958  >  23 [ACK] Seq=43 Ack=116 Win=33580 Len=0 TSval=184598 TSecr=9113111"
"62","16.544314","202.77.162.213","172.16.115.20","Portmap","98","V2 GETPORT Call (Reply In 63) SADMIND(100232) V:10 UDP"
"63","16.545563","172.16.115.20","202.77.162.213","Portmap","70","V2 GETPORT Reply (Call In 62) Port:32773"
"64","16.554110","202.77.162.213","172.16.115.20","SADMIND","1454","V10 proc-1 Call"
"65","18.593939","202.77.162.213","172.16.115.20","Portmap","98","V2 GETPORT Call (Reply In 66) SADMIND(100232) V:10 UDP"
"66","18.595228","172.16.115.20","202.77.162.213","Portmap","70","V2 GETPORT Reply (Call In 65) Port:32773"
"67","18.611478","202.77.162.213","172.16.115.20","SADMIND","1454","V10 proc-1 Call"
"68","20.622603","202.77.162.213","172.16.115.20","TCP","66","46958  >  23 [FIN, ACK] Seq=43 Ack=116 Win=33580 Len=0 TSval=184606 TSecr=9113111"
"69","20.622802","172.16.115.20","202.77.162.213","TCP","66","23  >  46958 [ACK] Seq=116 Ack=44 Win=10136 Len=0 TSval=9113522 TSecr=184606"
"70","20.627675","202.77.162.213","172.16.115.20","TCP","74","46959  >  23 [SYN] Seq=0 Win=32768 Len=0 MSS=1460 WS=1 TSval=184606 TSecr=0"
"71","20.627969","172.16.115.20","202.77.162.213","TCP","74","23  >  46959 [SYN, ACK] Seq=0 Ack=1 Win=10136 Len=0 TSval=9113522 TSecr=184606 WS=1 MSS=1460"
"72","20.628126","202.77.162.213","172.16.115.20","TCP","66","46959  >  23 [ACK] Seq=1 Ack=1 Win=33580 Len=0 TSval=184606 TSecr=9113522"
"73","20.635529","172.16.115.20","202.77.162.213","TCP","66","23  >  46958 [FIN, ACK] Seq=116 Ack=44 Win=10136 Len=0 TSval=9113523 TSecr=184606"
"74","20.635676","202.77.162.213","172.16.115.20","TCP","66","46958  >  23 [ACK] Seq=44 Ack=117 Win=33580 Len=0 TSval=184606 TSecr=9113523"
"75","21.858609","172.16.115.20","202.77.162.213","TELNET","81","Telnet Data ..."
"76","21.861793","202.77.162.213","172.16.115.20","TELNET","81","Telnet Data ..."
"77","21.861999","172.16.115.20","202.77.162.213","TCP","66","23  >  46959 [ACK] Seq=16 Ack=16 Win=10136 Len=0 TSval=9113646 TSecr=184609"
"78","21.864774","172.16.115.20","202.77.162.213","TELNET","102","Telnet Data ..."
"79","21.877647","202.77.162.213","172.16.115.20","TCP","66","46959  >  23 [ACK] Seq=16 Ack=52 Win=33580 Len=0 TSval=184609 TSecr=9113646"
"80","21.915990","172.16.115.20","202.77.162.213","TELNET","75","Telnet Data ..."
"81","21.918555","202.77.162.213","172.16.115.20","TELNET","75","Telnet Data ..."
"82","21.918814","172.16.115.20","202.77.162.213","TELNET","73","Telnet Data ..."
"83","21.920939","202.77.162.213","172.16.115.20","TELNET","75","Telnet Data ..."
"84","21.921139","172.16.115.20","202.77.162.213","TELNET","69","Telnet Data ..."
"85","21.937675","202.77.162.213","172.16.115.20","TCP","66","46959  >  23 [ACK] Seq=34 Ack=71 Win=33580 Len=0 TSval=184609 TSecr=9113652"
"86","21.937892","172.16.115.20","202.77.162.213","TELNET","85","Telnet Data ..."
"87","21.939925","202.77.162.213","172.16.115.20","TELNET","75","Telnet Data ..."
"88","21.940734","172.16.115.20","202.77.162.213","TELNET","68","Telnet Data ..."
"89","21.957898","202.77.162.213","172.16.115.20","TCP","66","46959  >  23 [ACK] Seq=43 Ack=92 Win=33580 Len=0 TSval=184609 TSecr=9113654"
"90","22.043148","172.16.115.20","202.77.162.213","TELNET","128","Telnet Data ..."
"91","22.057890","202.77.162.213","172.16.115.20","TCP","66","46959  >  23 [ACK] Seq=43 Ack=154 Win=33580 Len=0 TSval=184609 TSecr=9113664"
"92","22.071280","172.16.115.20","202.77.162.213","TELNET","68","Telnet Data ..."
"93","22.087849","202.77.162.213","172.16.115.20","TCP","66","46959  >  23 [ACK] Seq=43 Ack=156 Win=33580 Len=0 TSval=184609 TSecr=9113667"
"94","22.218538","202.77.162.213","172.16.115.20","TCP","66","46959  >  23 [FIN, ACK] Seq=43 Ack=156 Win=33580 Len=0 TSval=184609 TSecr=9113667"
"95","22.218695","172.16.115.20","202.77.162.213","TCP","66","23  >  46959 [ACK] Seq=156 Ack=44 Win=10136 Len=0 TSval=9113681 TSecr=184609"
"96","22.232975","172.16.115.20","202.77.162.213","TCP","66","23  >  46959 [FIN, ACK] Seq=156 Ack=44 Win=10136 Len=0 TSval=9113683 TSecr=184609"
"97","22.233136","202.77.162.213","172.16.115.20","TCP","66","46959  >  23 [ACK] Seq=44 Ack=157 Win=33580 Len=0 TSval=184610 TSecr=9113683"
"98","85.825369","202.77.162.213","172.16.112.10","Portmap","98","V2 GETPORT Call (Reply In 99) SADMIND(100232) V:10 UDP"
"99","85.826630","172.16.112.10","202.77.162.213","Portmap","70","V2 GETPORT Reply (Call In 98) Port:32774"
"100","85.835229","202.77.162.213","172.16.112.10","SADMIND","1454","V10 proc-1 Call"
"101","87.862975","202.77.162.213","172.16.112.10","Portmap","98","V2 GETPORT Call (Reply In 102) SADMIND(100232) V:10 UDP"
"102","87.863816","172.16.112.10","202.77.162.213","Portmap","70","V2 GETPORT Reply (Call In 101) Port:32774"
"103","87.872414","202.77.162.213","172.16.112.10","SADMIND","1454","V10 proc-1 Call"
"104","89.878347","202.77.162.213","172.16.112.10","TCP","74","46986  >  23 [SYN] Seq=0 Win=32768 Len=0 MSS=1460 WS=1 TSval=184745 TSecr=0"
"105","89.878578","172.16.112.10","202.77.162.213","TCP","58","23  >  46986 [SYN, ACK] Seq=0 Ack=1 Win=8760 Len=0 MSS=1460"
"106","89.878846","202.77.162.213","172.16.112.10","TCP","60","46986  >  23 [ACK] Seq=1 Ack=1 Win=33580 Len=0"
"107","89.931747","172.16.112.10","202.77.162.213","TELNET","69","Telnet Data ..."
"108","89.935019","202.77.162.213","172.16.112.10","TELNET","69","Telnet Data ..."
"109","89.936486","172.16.112.10","202.77.162.213","TELNET","117","Telnet Data ..."
"110","89.948546","202.77.162.213","172.16.112.10","TCP","60","46986  >  23 [ACK] Seq=16 Ack=79 Win=33580 Len=0"
"111","89.972784","172.16.112.10","202.77.162.213","TELNET","63","Telnet Data ..."
"112","89.975461","202.77.162.213","172.16.112.10","TELNET","63","Telnet Data ..."
"113","89.975754","172.16.112.10","202.77.162.213","TELNET","61","Telnet Data ..."
"114","89.978043","202.77.162.213","172.16.112.10","TELNET","63","Telnet Data ..."
"115","89.978225","172.16.112.10","202.77.162.213","TELNET","57","Telnet Data ..."
"116","89.988121","202.77.162.213","172.16.112.10","TCP","60","46986  >  23 [ACK] Seq=34 Ack=98 Win=33577 Len=0"
"117","89.988201","172.16.112.10","202.77.162.213","TELNET","73","Telnet Data ..."
"118","89.998718","202.77.162.213","172.16.112.10","TCP","60","46986  >  23 [ACK] Seq=34 Ack=117 Win=33561 Len=0"
"119","90.000668","202.77.162.213","172.16.112.10","TELNET","63","Telnet Data ..."
"120","90.001187","172.16.112.10","202.77.162.213","TELNET","56","Telnet Data ..."
"121","90.018718","202.77.162.213","172.16.112.10","TCP","60","46986  >  23 [ACK] Seq=43 Ack=119 Win=33580 Len=0"
"122","94.009391","172.16.112.10","202.77.162.213","TELNET","71","Telnet Data ..."
"123","94.028848","202.77.162.213","172.16.112.10","TCP","60","46986  >  23 [ACK] Seq=43 Ack=136 Win=33580 Len=0"
"124","94.028901","172.16.112.10","202.77.162.213","TELNET","61","Telnet Data ..."
"125","94.048823","202.77.162.213","172.16.112.10","TCP","60","46986  >  23 [ACK] Seq=43 Ack=143 Win=33580 Len=0"
"126","94.055183","202.77.162.213","172.16.112.10","Portmap","98","V2 GETPORT Call (Reply In 127) SADMIND(100232) V:10 UDP"
"127","94.056107","172.16.112.10","202.77.162.213","Portmap","70","V2 GETPORT Reply (Call In 126) Port:32774"
"128","94.064714","202.77.162.213","172.16.112.10","SADMIND","1454","V10 proc-1 Call"
"129","96.093220","202.77.162.213","172.16.112.10","Portmap","98","V2 GETPORT Call (Reply In 130) SADMIND(100232) V:10 UDP"
"130","96.094079","172.16.112.10","202.77.162.213","Portmap","70","V2 GETPORT Reply (Call In 129) Port:32774"
"131","96.102649","202.77.162.213","172.16.112.10","SADMIND","1454","V10 proc-1 Call"
"132","98.103756","202.77.162.213","172.16.112.10","TCP","60","46986  >  23 [FIN, ACK] Seq=43 Ack=143 Win=33580 Len=0"
"133","98.103827","172.16.112.10","202.77.162.213","TCP","54","23  >  46986 [ACK] Seq=143 Ack=44 Win=8760 Len=0"
"134","98.108658","202.77.162.213","172.16.112.10","TCP","74","46987  >  23 [SYN] Seq=0 Win=32768 Len=0 MSS=1460 WS=1 TSval=184761 TSecr=0"
"135","98.108925","172.16.112.10","202.77.162.213","TCP","58","23  >  46987 [SYN, ACK] Seq=0 Ack=1 Win=8760 Len=0 MSS=1460"
"136","98.109209","202.77.162.213","172.16.112.10","TCP","60","46987  >  23 [ACK] Seq=1 Ack=1 Win=33580 Len=0"
"137","98.155131","172.16.112.10","202.77.162.213","TCP","54","23  >  46986 [FIN, ACK] Seq=143 Ack=44 Win=8760 Len=0"
"138","98.155414","202.77.162.213","172.16.112.10","TCP","60","46986  >  23 [ACK] Seq=44 Ack=144 Win=33580 Len=0"
"139","98.163300","172.16.112.10","202.77.162.213","TELNET","69","Telnet Data ..."
"140","98.166505","202.77.162.213","172.16.112.10","TELNET","69","Telnet Data ..."
"141","98.167943","172.16.112.10","202.77.162.213","TELNET","117","Telnet Data ..."
"142","98.187577","202.77.162.213","172.16.112.10","TCP","60","46987  >  23 [ACK] Seq=16 Ack=79 Win=33517 Len=0"
"143","98.205175","172.16.112.10","202.77.162.213","TELNET","63","Telnet Data ..."
"144","98.207989","202.77.162.213","172.16.112.10","TELNET","63","Telnet Data ..."
"145","98.208051","172.16.112.10","202.77.162.213","TELNET","61","Telnet Data ..."
"146","98.210333","202.77.162.213","172.16.112.10","TELNET","63","Telnet Data ..."
"147","98.210507","172.16.112.10","202.77.162.213","TELNET","57","Telnet Data ..."
"148","98.228836","202.77.162.213","172.16.112.10","TCP","60","46987  >  23 [ACK] Seq=34 Ack=98 Win=33580 Len=0"
"149","98.228896","172.16.112.10","202.77.162.213","TELNET","73","Telnet Data ..."
"150","98.231108","202.77.162.213","172.16.112.10","TELNET","63","Telnet Data ..."
"151","98.231627","172.16.112.10","202.77.162.213","TELNET","56","Telnet Data ..."
"152","98.248809","202.77.162.213","172.16.112.10","TCP","60","46987  >  23 [ACK] Seq=43 Ack=119 Win=33580 Len=0"
"153","98.255003","172.16.112.10","202.77.162.213","TELNET","109","Telnet Data ..."
"154","98.268806","202.77.162.213","172.16.112.10","TCP","60","46987  >  23 [ACK] Seq=43 Ack=174 Win=33580 Len=0"
"155","98.319627","172.16.112.10","202.77.162.213","TELNET","117","Telnet Data ..."
"156","98.338800","202.77.162.213","172.16.112.10","TCP","60","46987  >  23 [ACK] Seq=43 Ack=237 Win=33580 Len=0"
"157","98.347299","172.16.112.10","202.77.162.213","TELNET","56","Telnet Data ..."
"158","98.358806","202.77.162.213","172.16.112.10","TCP","60","46987  >  23 [ACK] Seq=43 Ack=239 Win=33580 Len=0"
"159","98.374354","202.77.162.213","172.16.112.50","Portmap","98","V2 GETPORT Call (Reply In 160) SADMIND(100232) V:10 UDP"
"160","98.375891","172.16.112.50","202.77.162.213","Portmap","70","V2 GETPORT Reply (Call In 159) Port:32773"
"161","98.384345","202.77.162.213","172.16.112.50","SADMIND","1454","V10 proc-1 Call"
"162","100.412778","202.77.162.213","172.16.112.50","Portmap","98","V2 GETPORT Call (Reply In 163) SADMIND(100232) V:10 UDP"
"163","100.414147","172.16.112.50","202.77.162.213","Portmap","70","V2 GETPORT Reply (Call In 162) Port:32773"
"164","100.422560","202.77.162.213","172.16.112.50","SADMIND","1454","V10 proc-1 Call"
"165","102.423712","202.77.162.213","172.16.112.10","TCP","60","46987  >  23 [FIN, ACK] Seq=43 Ack=239 Win=33580 Len=0"
"166","102.423773","172.16.112.10","202.77.162.213","TCP","54","23  >  46987 [ACK] Seq=239 Ack=44 Win=8760 Len=0"
"167","102.428589","202.77.162.213","172.16.112.50","TCP","74","46988  >  23 [SYN] Seq=0 Win=32768 Len=0 MSS=1460 WS=1 TSval=184770 TSecr=0"
"168","102.428901","172.16.112.50","202.77.162.213","TCP","60","23  >  46988 [SYN, ACK] Seq=0 Ack=1 Win=8760 Len=0 MSS=1460"
"169","102.429048","202.77.162.213","172.16.112.50","TCP","60","46988  >  23 [ACK] Seq=1 Ack=1 Win=33580 Len=0"
"170","102.432030","172.16.112.10","202.77.162.213","TCP","54","23  >  46987 [FIN, ACK] Seq=239 Ack=44 Win=8760 Len=0"
"171","102.432317","202.77.162.213","172.16.112.10","TCP","60","46987  >  23 [ACK] Seq=44 Ack=240 Win=33580 Len=0"
"172","102.511948","172.16.112.50","202.77.162.213","TELNET","69","Telnet Data ..."
"173","102.515040","202.77.162.213","172.16.112.50","TELNET","69","Telnet Data ..."
"174","102.517756","172.16.112.50","202.77.162.213","TELNET","118","Telnet Data ..."
"175","102.538747","202.77.162.213","172.16.112.50","TCP","60","46988  >  23 [ACK] Seq=16 Ack=80 Win=33580 Len=0"
"176","102.571586","172.16.112.50","202.77.162.213","TELNET","63","Telnet Data ..."
"177","102.574070","202.77.162.213","172.16.112.50","TELNET","63","Telnet Data ..."
"178","102.574286","172.16.112.50","202.77.162.213","TELNET","61","Telnet Data ..."
"179","102.576442","202.77.162.213","172.16.112.50","TELNET","63","Telnet Data ..."
"180","102.576654","172.16.112.50","202.77.162.213","TELNET","60","Telnet Data ..."
"181","102.587153","202.77.162.213","172.16.112.50","TCP","60","46988  >  23 [ACK] Seq=34 Ack=99 Win=33577 Len=0"
"182","102.587354","172.16.112.50","202.77.162.213","TELNET","73","Telnet Data ..."
"183","102.588718","202.77.162.213","172.16.112.50","TCP","60","46988  >  23 [ACK] Seq=34 Ack=118 Win=33561 Len=0"
"184","102.590634","202.77.162.213","172.16.112.50","TELNET","63","Telnet Data ..."
"185","102.591402","172.16.112.50","202.77.162.213","TELNET","60","Telnet Data ..."
"186","102.608708","202.77.162.213","172.16.112.50","TCP","60","46988  >  23 [ACK] Seq=43 Ack=120 Win=33580 Len=0"
"187","106.610216","172.16.112.50","202.77.162.213","TELNET","71","Telnet Data ..."
"188","106.628759","202.77.162.213","172.16.112.50","TCP","60","46988  >  23 [ACK] Seq=43 Ack=137 Win=33580 Len=0"
"189","106.628909","172.16.112.50","202.77.162.213","TELNET","61","Telnet Data ..."
"190","106.648797","202.77.162.213","172.16.112.50","TCP","60","46988  >  23 [ACK] Seq=43 Ack=144 Win=33580 Len=0"
"191","106.655402","202.77.162.213","172.16.112.50","Portmap","98","V2 GETPORT Call (Reply In 192) SADMIND(100232) V:10 UDP"
"192","106.657030","172.16.112.50","202.77.162.213","Portmap","70","V2 GETPORT Reply (Call In 191) Port:32773"
"193","106.665479","202.77.162.213","172.16.112.50","SADMIND","1454","V10 proc-1 Call"
"194","108.692863","202.77.162.213","172.16.112.50","Portmap","98","V2 GETPORT Call (Reply In 195) SADMIND(100232) V:10 UDP"
"195","108.694218","172.16.112.50","202.77.162.213","Portmap","70","V2 GETPORT Reply (Call In 194) Port:32773"
"196","108.702639","202.77.162.213","172.16.112.50","SADMIND","1454","V10 proc-1 Call"
"197","110.704497","202.77.162.213","172.16.112.50","TCP","60","46988  >  23 [FIN, ACK] Seq=43 Ack=144 Win=33580 Len=0"
"198","110.704632","172.16.112.50","202.77.162.213","TCP","60","23  >  46988 [ACK] Seq=144 Ack=44 Win=8760 Len=0"
"199","110.708885","202.77.162.213","172.16.112.50","TCP","74","47014  >  23 [SYN] Seq=0 Win=32768 Len=0 MSS=1460 WS=1 TSval=184786 TSecr=0"
"200","110.709252","172.16.112.50","202.77.162.213","TCP","60","23  >  47014 [SYN, ACK] Seq=0 Ack=1 Win=8760 Len=0 MSS=1460"
"201","110.709397","202.77.162.213","172.16.112.50","TCP","60","47014  >  23 [ACK] Seq=1 Ack=1 Win=33580 Len=0"
"202","110.755268","172.16.112.50","202.77.162.213","TCP","60","23  >  46988 [FIN, ACK] Seq=144 Ack=44 Win=8760 Len=0"
"203","110.755401","202.77.162.213","172.16.112.50","TCP","60","46988  >  23 [ACK] Seq=44 Ack=145 Win=33580 Len=0"
"204","110.797576","172.16.112.50","202.77.162.213","TELNET","69","Telnet Data ..."
"205","110.800663","202.77.162.213","172.16.112.50","TELNET","69","Telnet Data ..."
"206","110.803314","172.16.112.50","202.77.162.213","TELNET","118","Telnet Data ..."
"207","110.818825","202.77.162.213","172.16.112.50","TCP","60","47014  >  23 [ACK] Seq=16 Ack=80 Win=33580 Len=0"
"208","110.852230","172.16.112.50","202.77.162.213","TELNET","63","Telnet Data ..."
"209","110.854791","202.77.162.213","172.16.112.50","TELNET","63","Telnet Data ..."
"210","110.854998","172.16.112.50","202.77.162.213","TELNET","61","Telnet Data ..."
"211","110.857105","202.77.162.213","172.16.112.50","TELNET","63","Telnet Data ..."
"212","110.857287","172.16.112.50","202.77.162.213","TELNET","60","Telnet Data ..."
"213","110.868788","202.77.162.213","172.16.112.50","TCP","60","47014  >  23 [ACK] Seq=34 Ack=99 Win=33580 Len=0"
"214","110.868940","172.16.112.50","202.77.162.213","TELNET","63","Telnet Data ..."
"215","110.888745","202.77.162.213","172.16.112.50","TCP","60","47014  >  23 [ACK] Seq=34 Ack=108 Win=33580 Len=0"
"216","110.888908","172.16.112.50","202.77.162.213","TELNET","64","Telnet Data ..."
"217","110.890892","202.77.162.213","172.16.112.50","TELNET","63","Telnet Data ..."
"218","110.891641","172.16.112.50","202.77.162.213","TELNET","60","Telnet Data ..."
"219","110.908751","202.77.162.213","172.16.112.50","TCP","60","47014  >  23 [ACK] Seq=43 Ack=120 Win=33580 Len=0"
"220","110.951745","172.16.112.50","202.77.162.213","TELNET","98","Telnet Data ..."
"221","110.968962","202.77.162.213","172.16.112.50","TCP","60","47014  >  23 [ACK] Seq=43 Ack=164 Win=33580 Len=0"
"222","111.055546","172.16.112.50","202.77.162.213","TELNET","1192","Telnet Data ..."
"223","111.078975","202.77.162.213","172.16.112.50","TCP","60","47014  >  23 [ACK] Seq=43 Ack=1302 Win=33580 Len=0"
"224","111.090072","172.16.112.50","202.77.162.213","TELNET","62","Telnet Data ..."
"225","111.108974","202.77.162.213","172.16.112.50","TCP","60","47014  >  23 [ACK] Seq=43 Ack=1310 Win=33580 Len=0"
