"No.","Time","Source","Destination","Protocol","Length","Info"
"1","0.000000","202.77.162.213","172.16.115.20","TCP","74","47496  >  23 [SYN] Seq=0 Win=32768 Len=0 MSS=1460 WS=1 TSval=186587 TSecr=0"
"2","0.000385","172.16.115.20","202.77.162.213","TCP","74","23  >  47496 [SYN, ACK] Seq=0 Ack=1 Win=10136 Len=0 TSval=9212571 TSecr=186587 WS=1 MSS=1460"
"3","0.000537","202.77.162.213","172.16.115.20","TCP","66","47496  >  23 [ACK] Seq=1 Ack=1 Win=33580 Len=0 TSval=186587 TSecr=9212571"
"4","0.070451","172.16.115.20","202.77.162.213","TELNET","81","Telnet Data ..."
"5","0.073588","202.77.162.213","172.16.115.20","TELNET","81","Telnet Data ..."
"6","0.073792","172.16.115.20","202.77.162.213","TCP","66","23  >  47496 [ACK] Seq=16 Ack=16 Win=10136 Len=0 TSval=9212578 TSecr=186588"
"7","0.076678","172.16.115.20","202.77.162.213","TELNET","102","Telnet Data ..."
"8","0.092516","202.77.162.213","172.16.115.20","TCP","66","47496  >  23 [ACK] Seq=16 Ack=52 Win=33580 Len=0 TSval=186588 TSecr=9212579"
"9","0.128601","172.16.115.20","202.77.162.213","TELNET","75","Telnet Data ..."
"10","0.131179","202.77.162.213","172.16.115.20","TELNET","75","Telnet Data ..."
"11","0.131430","172.16.115.20","202.77.162.213","TELNET","73","Telnet Data ..."
"12","0.133540","202.77.162.213","172.16.115.20","TELNET","75","Telnet Data ..."
"13","0.133738","172.16.115.20","202.77.162.213","TELNET","69","Telnet Data ..."
"14","0.152506","202.77.162.213","172.16.115.20","TCP","66","47496  >  23 [ACK] Seq=34 Ack=71 Win=33580 Len=0 TSval=186588 TSecr=9212584"
"15","0.152726","172.16.115.20","202.77.162.213","TELNET","85","Telnet Data ..."
"16","0.154798","202.77.162.213","172.16.115.20","TELNET","75","Telnet Data ..."
"17","0.155606","172.16.115.20","202.77.162.213","TELNET","68","Telnet Data ..."
"18","0.172529","202.77.162.213","172.16.115.20","TCP","66","47496  >  23 [ACK] Seq=43 Ack=92 Win=33580 Len=0 TSval=186588 TSecr=9212587"
"19","0.199494","172.16.115.20","202.77.162.213","TELNET","121","Telnet Data ..."
"20","0.212530","202.77.162.213","172.16.115.20","TCP","66","47496  >  23 [ACK] Seq=43 Ack=147 Win=33580 Len=0 TSval=186588 TSecr=9212591"
"21","0.257915","172.16.115.20","202.77.162.213","TELNET","128","Telnet Data ..."
"22","0.272475","202.77.162.213","172.16.115.20","TCP","66","47496  >  23 [ACK] Seq=43 Ack=209 Win=33580 Len=0 TSval=186588 TSecr=9212597"
"23","0.286313","172.16.115.20","202.77.162.213","TELNET","68","Telnet Data ..."
"24","0.289408","202.77.162.213","172.16.115.20","TELNET","87","Telnet Data ..."
"25","0.289822","172.16.115.20","202.77.162.213","TELNET","87","Telnet Data ..."
"26","0.302558","202.77.162.213","172.16.115.20","TCP","66","47496  >  23 [ACK] Seq=64 Ack=232 Win=33580 Len=0 TSval=186588 TSecr=9212600"
"27","0.304855","172.16.115.20","202.77.162.213","TELNET","68","Telnet Data ..."
"28","0.309355","202.77.162.213","172.16.115.20","TELNET","84","Telnet Data ..."
"29","0.309736","172.16.115.20","202.77.162.213","TELNET","84","Telnet Data ..."
"30","0.322459","202.77.162.213","172.16.115.20","TCP","66","47496  >  23 [ACK] Seq=82 Ack=252 Win=33580 Len=0 TSval=186588 TSecr=9212602"
"31","0.322645","172.16.115.20","202.77.162.213","TELNET","68","Telnet Data ..."
"32","0.326804","202.77.162.213","172.16.115.20","TELNET","147","Telnet Data ..."
"33","0.327394","172.16.115.20","202.77.162.213","TELNET","147","Telnet Data ..."
"34","0.342513","202.77.162.213","172.16.115.20","TCP","66","47496  >  23 [ACK] Seq=163 Ack=335 Win=33580 Len=0 TSval=186588 TSecr=9212604"
"35","0.351900","172.16.115.20","202.77.162.213","TCP","60","1023  >  514 [SYN] Seq=0 Win=8760 Len=0 MSS=1460"
"36","0.352054","202.77.162.213","172.16.115.20","TCP","60","514  >  1023 [SYN, ACK] Seq=0 Ack=1 Win=33580 Len=0 MSS=1460"
"37","0.352260","172.16.115.20","202.77.162.213","TCP","60","1023  >  514 [ACK] Seq=1 Ack=1 Win=8760 Len=0"
"38","0.352432","172.16.115.20","202.77.162.213","RSH","60","Session Establishment"
"39","0.396659","202.77.162.213","172.16.115.20","TCP","60","514  >  1023 [ACK] Seq=1 Ack=2 Win=33580 Len=0"
"40","0.396906","172.16.115.20","202.77.162.213","RSH","139","Session Establishment"
"41","0.480530","202.77.162.213","172.16.115.20","RSH","60","Server username:root Server -> Client Data"
"42","0.480675","172.16.115.20","202.77.162.213","TCP","60","1023  >  514 [ACK] Seq=87 Ack=2 Win=8760 Len=0"
"43","0.535875","202.77.162.213","172.16.115.20","RSH","105","Server username:root Server -> Client Data"
"44","0.536206","172.16.115.20","202.77.162.213","TCP","60","1023  >  514 [FIN, ACK] Seq=87 Ack=53 Win=8760 Len=0"
"45","0.536344","202.77.162.213","172.16.115.20","TCP","60","514  >  1023 [ACK] Seq=53 Ack=88 Win=33580 Len=0"
"46","0.536523","202.77.162.213","172.16.115.20","TCP","60","514  >  1023 [FIN, ACK] Seq=53 Ack=88 Win=33580 Len=0"
"47","0.536676","172.16.115.20","202.77.162.213","TCP","60","1023  >  514 [ACK] Seq=88 Ack=54 Win=8760 Len=0"
"48","0.537328","172.16.115.20","202.77.162.213","TCP","60","1022  >  514 [SYN] Seq=0 Win=8760 Len=0 MSS=1460"
"49","0.537482","202.77.162.213","172.16.115.20","TCP","60","514  >  1022 [SYN, ACK] Seq=0 Ack=1 Win=33580 Len=0 MSS=1460"
"50","0.537647","172.16.115.20","202.77.162.213","TCP","60","1022  >  514 [ACK] Seq=1 Ack=1 Win=8760 Len=0"
"51","0.537764","172.16.115.20","202.77.162.213","RSH","60","Session Establishment"
"52","0.596602","202.77.162.213","172.16.115.20","TCP","60","514  >  1022 [ACK] Seq=1 Ack=2 Win=33580 Len=0"
"53","0.596836","172.16.115.20","202.77.162.213","RSH","125","Session Establishment"
"54","0.796609","202.77.162.213","172.16.115.20","TCP","60","514  >  1022 [ACK] Seq=1 Ack=73 Win=33580 Len=0"
"55","1.656323","202.77.162.213","172.16.115.20","RSH","60","Server username:root Server -> Client Data"
"56","1.656498","172.16.115.20","202.77.162.213","TCP","60","1022  >  514 [ACK] Seq=73 Ack=2 Win=8760 Len=0"
"57","1.656832","172.16.115.20","202.77.162.213","RSH","60","Server username:root Client -> Server data"
"58","1.715674","202.77.162.213","172.16.115.20","RSH","77","Server username:root Server -> Client Data"
"59","1.716833","172.16.115.20","202.77.162.213","RSH","60","Server username:root Client -> Server data"
"60","1.723774","202.77.162.213","172.16.115.20","RSH","1514","Server username:root Server -> Client Data"
"61","1.725029","202.77.162.213","172.16.115.20","RSH","1514","Server username:root Server -> Client Data"
"62","1.726267","202.77.162.213","172.16.115.20","RSH","1514","Server username:root Server -> Client Data"
"63","1.726335","172.16.115.20","202.77.162.213","TCP","60","1022  >  514 [ACK] Seq=75 Ack=1485 Win=24820 Len=0"
"64","1.726406","172.16.115.20","202.77.162.213","TCP","60","1022  >  514 [ACK] Seq=75 Ack=2945 Win=24820 Len=0"
"65","1.727876","202.77.162.213","172.16.115.20","RSH","1514","Server username:root Server -> Client Data"
"66","1.728050","172.16.115.20","202.77.162.213","TCP","60","1022  >  514 [ACK] Seq=75 Ack=5865 Win=24820 Len=0"
"67","1.731366","202.77.162.213","172.16.115.20","RSH","1514","Server username:root Server -> Client Data"
"68","1.733004","202.77.162.213","172.16.115.20","RSH","1514","Server username:root Server -> Client Data"
"69","1.734236","202.77.162.213","172.16.115.20","RSH","1514","Server username:root Server -> Client Data"
"70","1.734361","172.16.115.20","202.77.162.213","TCP","60","1022  >  514 [ACK] Seq=75 Ack=8785 Win=24820 Len=0"
"71","1.735559","202.77.162.213","172.16.115.20","RSH","1514","Server username:root Server -> Client Data"
"72","1.736781","202.77.162.213","172.16.115.20","RSH","1514","Server username:root Server -> Client Data"
"73","1.736858","172.16.115.20","202.77.162.213","TCP","60","1022  >  514 [ACK] Seq=75 Ack=11705 Win=24820 Len=0"
"74","1.738090","202.77.162.213","172.16.115.20","RSH","1514","Server username:root Server -> Client Data"
"75","1.738264","172.16.115.20","202.77.162.213","TCP","60","1022  >  514 [ACK] Seq=75 Ack=14625 Win=24820 Len=0"
"76","1.743055","202.77.162.213","172.16.115.20","RSH","1514","Server username:root Server -> Client Data"
"77","1.744421","202.77.162.213","172.16.115.20","RSH","1514","Server username:root Server -> Client Data"
"78","1.745691","202.77.162.213","172.16.115.20","RSH","1514","Server username:root Server -> Client Data"
"79","1.745755","172.16.115.20","202.77.162.213","TCP","60","1022  >  514 [ACK] Seq=75 Ack=17545 Win=24820 Len=0"
"80","1.747074","202.77.162.213","172.16.115.20","RSH","1514","Server username:root Server -> Client Data"
"81","1.748310","202.77.162.213","172.16.115.20","RSH","1514","Server username:root Server -> Client Data"
"82","1.748389","172.16.115.20","202.77.162.213","TCP","60","1022  >  514 [ACK] Seq=75 Ack=20465 Win=24820 Len=0"
"83","1.749686","202.77.162.213","172.16.115.20","RSH","1514","Server username:root Server -> Client Data"
"84","1.750897","202.77.162.213","172.16.115.20","RSH","1514","Server username:root Server -> Client Data"
"85","1.750977","172.16.115.20","202.77.162.213","TCP","60","1022  >  514 [ACK] Seq=75 Ack=23385 Win=24820 Len=0"
"86","1.752219","202.77.162.213","172.16.115.20","RSH","1514","Server username:root Server -> Client Data"
"87","1.753442","202.77.162.213","172.16.115.20","RSH","1514","Server username:root Server -> Client Data"
"88","1.753517","172.16.115.20","202.77.162.213","TCP","60","1022  >  514 [ACK] Seq=75 Ack=26305 Win=24820 Len=0"
"89","1.754760","202.77.162.213","172.16.115.20","RSH","1514","Server username:root Server -> Client Data"
"90","1.754939","172.16.115.20","202.77.162.213","TCP","60","1022  >  514 [ACK] Seq=75 Ack=29225 Win=24820 Len=0"
"91","1.756170","202.77.162.213","172.16.115.20","RSH","1514","Server username:root Server -> Client Data"
"92","1.757418","202.77.162.213","172.16.115.20","RSH","1514","Server username:root Server -> Client Data"
"93","1.758742","202.77.162.213","172.16.115.20","RSH","1514","Server username:root Server -> Client Data"
"94","1.758811","172.16.115.20","202.77.162.213","TCP","60","1022  >  514 [ACK] Seq=75 Ack=32145 Win=24820 Len=0"
"95","1.760139","202.77.162.213","172.16.115.20","RSH","1514","Server username:root Server -> Client Data"
"96","1.761368","202.77.162.213","172.16.115.20","RSH","1514","Server username:root Server -> Client Data"
"97","1.761446","172.16.115.20","202.77.162.213","TCP","60","1022  >  514 [ACK] Seq=75 Ack=35065 Win=24820 Len=0"
"98","1.762950","202.77.162.213","172.16.115.20","RSH","1514","Server username:root Server -> Client Data"
"99","1.764180","202.77.162.213","172.16.115.20","RSH","1514","Server username:root Server -> Client Data"
"100","1.764262","172.16.115.20","202.77.162.213","TCP","60","1022  >  514 [ACK] Seq=75 Ack=37985 Win=24820 Len=0"
"101","1.765512","202.77.162.213","172.16.115.20","RSH","1514","Server username:root Server -> Client Data"
"102","1.766752","202.77.162.213","172.16.115.20","RSH","1514","Server username:root Server -> Client Data"
"103","1.766830","172.16.115.20","202.77.162.213","TCP","60","1022  >  514 [ACK] Seq=75 Ack=40905 Win=24820 Len=0"
"104","1.768145","202.77.162.213","172.16.115.20","RSH","1514","Server username:root Server -> Client Data"
"105","1.768332","172.16.115.20","202.77.162.213","TCP","60","1022  >  514 [ACK] Seq=75 Ack=43825 Win=24820 Len=0"
"106","1.769371","202.77.162.213","172.16.115.20","RSH","431","Server username:root Server -> Client Data"
"107","1.769929","172.16.115.20","202.77.162.213","RSH","60","Server username:root Client -> Server data"
"108","1.772020","202.77.162.213","172.16.115.20","TCP","60","514  >  1022 [FIN, ACK] Seq=44202 Ack=76 Win=33580 Len=0"
"109","1.772145","172.16.115.20","202.77.162.213","TCP","60","1022  >  514 [ACK] Seq=76 Ack=44203 Win=24820 Len=0"
"110","1.772330","172.16.115.20","202.77.162.213","TCP","60","1022  >  514 [FIN, ACK] Seq=76 Ack=44203 Win=24820 Len=0"
"111","1.772452","202.77.162.213","172.16.115.20","TCP","60","514  >  1022 [ACK] Seq=44203 Ack=77 Win=33580 Len=0"
"112","1.775203","172.16.115.20","202.77.162.213","TELNET","68","Telnet Data ..."
"113","1.780483","202.77.162.213","172.16.115.20","TELNET","88","Telnet Data ..."
"114","1.780878","172.16.115.20","202.77.162.213","TELNET","88","Telnet Data ..."
"115","1.792379","202.77.162.213","172.16.115.20","TCP","66","47496  >  23 [ACK] Seq=185 Ack=359 Win=33580 Len=0 TSval=186591 TSecr=9212749"
"116","1.794962","172.16.115.20","202.77.162.213","TELNET","68","Telnet Data ..."
"117","1.796483","202.77.162.213","172.16.115.20","TCP","66","47496  >  23 [ACK] Seq=185 Ack=361 Win=33578 Len=0 TSval=186591 TSecr=9212751"
"118","1.799109","202.77.162.213","172.16.115.20","TELNET","147","Telnet Data ..."
"119","1.799719","172.16.115.20","202.77.162.213","TELNET","147","Telnet Data ..."
"120","1.812360","202.77.162.213","172.16.115.20","TCP","66","47496  >  23 [ACK] Seq=266 Ack=442 Win=33580 Len=0 TSval=186591 TSecr=9212751"
"121","1.823815","172.16.115.20","202.77.162.213","TCP","60","[TCP Port numbers reused] 1022  >  514 [SYN] Seq=0 Win=8760 Len=0 MSS=1460"
"122","1.823962","202.77.162.213","172.16.115.20","TCP","60","514  >  1022 [SYN, ACK] Seq=0 Ack=1 Win=33580 Len=0 MSS=1460"
"123","1.824162","172.16.115.20","202.77.162.213","TCP","60","1022  >  514 [ACK] Seq=1 Ack=1 Win=8760 Len=0"
"124","1.824355","172.16.115.20","202.77.162.213","RSH","60","Session Establishment"
"125","1.996648","202.77.162.213","172.16.115.20","TCP","60","514  >  1022 [ACK] Seq=1 Ack=2 Win=33580 Len=0"
"126","1.996897","172.16.115.20","202.77.162.213","RSH","139","Session Establishment"
"127","2.196623","202.77.162.213","172.16.115.20","TCP","60","514  >  1022 [ACK] Seq=1 Ack=87 Win=33580 Len=0"
"128","2.882466","202.77.162.213","172.16.115.20","RSH","60","Server username:root Server -> Client Data"
"129","2.882639","172.16.115.20","202.77.162.213","TCP","60","1022  >  514 [ACK] Seq=87 Ack=2 Win=8760 Len=0"
"130","2.936101","202.77.162.213","172.16.115.20","RSH","105","Server username:root Server -> Client Data"
"131","2.936431","172.16.115.20","202.77.162.213","TCP","60","1022  >  514 [FIN, ACK] Seq=87 Ack=53 Win=8760 Len=0"
"132","2.936571","202.77.162.213","172.16.115.20","TCP","60","514  >  1022 [ACK] Seq=53 Ack=88 Win=33580 Len=0"
"133","2.936674","202.77.162.213","172.16.115.20","TCP","60","514  >  1022 [FIN, ACK] Seq=53 Ack=88 Win=33580 Len=0"
"134","2.936816","172.16.115.20","202.77.162.213","TCP","60","1022  >  514 [ACK] Seq=88 Ack=54 Win=8760 Len=0"
"135","2.937672","172.16.115.20","202.77.162.213","TCP","60","1021  >  514 [SYN] Seq=0 Win=8760 Len=0 MSS=1460"
"136","2.937844","202.77.162.213","172.16.115.20","TCP","60","514  >  1021 [SYN, ACK] Seq=0 Ack=1 Win=33580 Len=0 MSS=1460"
"137","2.938009","172.16.115.20","202.77.162.213","TCP","60","1021  >  514 [ACK] Seq=1 Ack=1 Win=8760 Len=0"
"138","2.938129","172.16.115.20","202.77.162.213","RSH","60","Session Establishment"
"139","2.996605","202.77.162.213","172.16.115.20","TCP","60","514  >  1021 [ACK] Seq=1 Ack=2 Win=33580 Len=0"
"140","2.996823","172.16.115.20","202.77.162.213","RSH","125","Session Establishment"
"141","3.196560","202.77.162.213","172.16.115.20","TCP","60","514  >  1021 [ACK] Seq=1 Ack=73 Win=33580 Len=0"
"142","4.058347","202.77.162.213","172.16.115.20","RSH","60","Server username:root Server -> Client Data"
"143","4.058502","172.16.115.20","202.77.162.213","TCP","60","1021  >  514 [ACK] Seq=73 Ack=2 Win=8760 Len=0"
"144","4.058834","172.16.115.20","202.77.162.213","RSH","60","Server username:root Client -> Server data"
"145","4.118571","202.77.162.213","172.16.115.20","RSH","77","Server username:root Server -> Client Data"
"146","4.119761","172.16.115.20","202.77.162.213","RSH","60","Server username:root Client -> Server data"
"147","4.126661","202.77.162.213","172.16.115.20","RSH","1514","Server username:root Server -> Client Data"
"148","4.127945","202.77.162.213","172.16.115.20","RSH","1514","Server username:root Server -> Client Data"
"149","4.129178","202.77.162.213","172.16.115.20","RSH","1514","Server username:root Server -> Client Data"
"150","4.129256","172.16.115.20","202.77.162.213","TCP","60","1021  >  514 [ACK] Seq=75 Ack=1485 Win=24820 Len=0"
"151","4.130513","202.77.162.213","172.16.115.20","RSH","1514","Server username:root Server -> Client Data"
"152","4.130588","172.16.115.20","202.77.162.213","TCP","60","1021  >  514 [ACK] Seq=75 Ack=2945 Win=24820 Len=0"
"153","4.130687","172.16.115.20","202.77.162.213","TCP","60","1021  >  514 [ACK] Seq=75 Ack=5865 Win=24820 Len=0"
"154","4.135519","202.77.162.213","172.16.115.20","RSH","1514","Server username:root Server -> Client Data"
"155","4.136810","202.77.162.213","172.16.115.20","RSH","1514","Server username:root Server -> Client Data"
"156","4.138029","202.77.162.213","172.16.115.20","RSH","1514","Server username:root Server -> Client Data"
"157","4.138108","172.16.115.20","202.77.162.213","TCP","60","1021  >  514 [ACK] Seq=75 Ack=8785 Win=24820 Len=0"
"158","4.139355","202.77.162.213","172.16.115.20","RSH","1514","Server username:root Server -> Client Data"
"159","4.140595","202.77.162.213","172.16.115.20","RSH","1514","Server username:root Server -> Client Data"
"160","4.140670","172.16.115.20","202.77.162.213","TCP","60","1021  >  514 [ACK] Seq=75 Ack=11705 Win=24820 Len=0"
"161","4.141981","202.77.162.213","172.16.115.20","RSH","1514","Server username:root Server -> Client Data"
"162","4.142164","172.16.115.20","202.77.162.213","TCP","60","1021  >  514 [ACK] Seq=75 Ack=14625 Win=24820 Len=0"
"163","4.144881","202.77.162.213","172.16.115.20","RSH","1514","Server username:root Server -> Client Data"
"164","4.146169","202.77.162.213","172.16.115.20","RSH","1514","Server username:root Server -> Client Data"
"165","4.146342","172.16.115.20","202.77.162.213","TCP","60","1021  >  514 [ACK] Seq=75 Ack=17545 Win=24820 Len=0"
"166","4.147573","202.77.162.213","172.16.115.20","RSH","1514","Server username:root Server -> Client Data"
"167","4.149430","202.77.162.213","172.16.115.20","RSH","1514","Server username:root Server -> Client Data"
"168","4.150663","202.77.162.213","172.16.115.20","RSH","1514","Server username:root Server -> Client Data"
"169","4.150743","172.16.115.20","202.77.162.213","TCP","60","1021  >  514 [ACK] Seq=75 Ack=20465 Win=24820 Len=0"
"170","4.152122","202.77.162.213","172.16.115.20","RSH","1514","Server username:root Server -> Client Data"
"171","4.153346","202.77.162.213","172.16.115.20","RSH","1514","Server username:root Server -> Client Data"
"172","4.153422","172.16.115.20","202.77.162.213","TCP","60","1021  >  514 [ACK] Seq=75 Ack=23385 Win=24820 Len=0"
"173","4.154655","202.77.162.213","172.16.115.20","RSH","1514","Server username:root Server -> Client Data"
"174","4.155994","202.77.162.213","172.16.115.20","RSH","1514","Server username:root Server -> Client Data"
"175","4.156072","172.16.115.20","202.77.162.213","TCP","60","1021  >  514 [ACK] Seq=75 Ack=26305 Win=24820 Len=0"
"176","4.157305","202.77.162.213","172.16.115.20","RSH","1514","Server username:root Server -> Client Data"
"177","4.158547","202.77.162.213","172.16.115.20","RSH","1514","Server username:root Server -> Client Data"
"178","4.158615","172.16.115.20","202.77.162.213","TCP","60","1021  >  514 [ACK] Seq=75 Ack=29225 Win=24820 Len=0"
"179","4.160011","202.77.162.213","172.16.115.20","RSH","1514","Server username:root Server -> Client Data"
"180","4.161243","202.77.162.213","172.16.115.20","RSH","1514","Server username:root Server -> Client Data"
"181","4.162474","202.77.162.213","172.16.115.20","RSH","1514","Server username:root Server -> Client Data"
"182","4.162579","172.16.115.20","202.77.162.213","TCP","60","1021  >  514 [ACK] Seq=75 Ack=32145 Win=24820 Len=0"
"183","4.163810","202.77.162.213","172.16.115.20","RSH","1514","Server username:root Server -> Client Data"
"184","4.163891","172.16.115.20","202.77.162.213","TCP","60","1021  >  514 [ACK] Seq=75 Ack=35065 Win=24820 Len=0"
"185","4.166904","202.77.162.213","172.16.115.20","RSH","1514","Server username:root Server -> Client Data"
"186","4.168176","202.77.162.213","172.16.115.20","RSH","1514","Server username:root Server -> Client Data"
"187","4.168255","172.16.115.20","202.77.162.213","TCP","60","1021  >  514 [ACK] Seq=75 Ack=37985 Win=24820 Len=0"
"188","4.169580","202.77.162.213","172.16.115.20","RSH","1514","Server username:root Server -> Client Data"
"189","4.170815","202.77.162.213","172.16.115.20","RSH","1514","Server username:root Server -> Client Data"
"190","4.170889","172.16.115.20","202.77.162.213","TCP","60","1021  >  514 [ACK] Seq=75 Ack=40905 Win=24820 Len=0"
"191","4.172122","202.77.162.213","172.16.115.20","RSH","1514","Server username:root Server -> Client Data"
"192","4.173367","202.77.162.213","172.16.115.20","RSH","1514","Server username:root Server -> Client Data"
"193","4.174586","202.77.162.213","172.16.115.20","RSH","1514","Server username:root Server -> Client Data"
"194","4.174666","172.16.115.20","202.77.162.213","TCP","60","1021  >  514 [ACK] Seq=75 Ack=43825 Win=24820 Len=0"
"195","4.175897","202.77.162.213","172.16.115.20","RSH","1514","Server username:root Server -> Client Data"
"196","4.175975","172.16.115.20","202.77.162.213","TCP","60","1021  >  514 [ACK] Seq=75 Ack=46745 Win=24820 Len=0"
"197","4.177380","202.77.162.213","172.16.115.20","RSH","1514","Server username:root Server -> Client Data"
"198","4.178611","202.77.162.213","172.16.115.20","RSH","1514","Server username:root Server -> Client Data"
"199","4.178691","172.16.115.20","202.77.162.213","TCP","60","1021  >  514 [ACK] Seq=75 Ack=49665 Win=24820 Len=0"
"200","4.179933","202.77.162.213","172.16.115.20","RSH","1514","Server username:root Server -> Client Data"
"201","4.181158","202.77.162.213","172.16.115.20","RSH","1514","Server username:root Server -> Client Data"
"202","4.181233","172.16.115.20","202.77.162.213","TCP","60","1021  >  514 [ACK] Seq=75 Ack=52585 Win=24820 Len=0"
"203","4.182585","202.77.162.213","172.16.115.20","RSH","1514","Server username:root Server -> Client Data"
"204","4.183829","202.77.162.213","172.16.115.20","RSH","1514","Server username:root Server -> Client Data"
"205","4.183907","172.16.115.20","202.77.162.213","TCP","60","1021  >  514 [ACK] Seq=75 Ack=55505 Win=24820 Len=0"
"206","4.185182","202.77.162.213","172.16.115.20","RSH","1514","Server username:root Server -> Client Data"
"207","4.185367","172.16.115.20","202.77.162.213","TCP","60","1021  >  514 [ACK] Seq=75 Ack=58425 Win=24820 Len=0"
"208","4.188458","202.77.162.213","172.16.115.20","RSH","1003","Server username:root Server -> Client Data"
"209","4.188997","172.16.115.20","202.77.162.213","RSH","60","Server username:root Client -> Server data"
"210","4.191096","202.77.162.213","172.16.115.20","TCP","60","514  >  1021 [FIN, ACK] Seq=59374 Ack=76 Win=33580 Len=0"
"211","4.191233","172.16.115.20","202.77.162.213","TCP","60","1021  >  514 [ACK] Seq=76 Ack=59375 Win=24820 Len=0"
"212","4.191418","172.16.115.20","202.77.162.213","TCP","60","1021  >  514 [FIN, ACK] Seq=76 Ack=59375 Win=24820 Len=0"
"213","4.191539","202.77.162.213","172.16.115.20","TCP","60","514  >  1021 [ACK] Seq=59375 Ack=77 Win=33580 Len=0"
"214","4.194421","172.16.115.20","202.77.162.213","TELNET","68","Telnet Data ..."
"215","4.196482","202.77.162.213","172.16.115.20","TCP","66","47496  >  23 [ACK] Seq=266 Ack=444 Win=33578 Len=0 TSval=186596 TSecr=9212991"
"216","4.199676","202.77.162.213","172.16.115.20","TELNET","88","Telnet Data ..."
"217","4.200034","172.16.115.20","202.77.162.213","TELNET","88","Telnet Data ..."
"218","4.212543","202.77.162.213","172.16.115.20","TCP","66","47496  >  23 [ACK] Seq=288 Ack=466 Win=33580 Len=0 TSval=186596 TSecr=9212991"
"219","4.213347","172.16.115.20","202.77.162.213","TELNET","68","Telnet Data ..."
"220","4.217334","202.77.162.213","172.16.115.20","TELNET","93","Telnet Data ..."
"221","4.217732","172.16.115.20","202.77.162.213","TELNET","93","Telnet Data ..."
"222","4.221728","202.77.162.213","172.16.115.20","TELNET","72","Telnet Data ..."
"223","4.221935","172.16.115.20","202.77.162.213","TELNET","68","Telnet Data ..."
"224","4.242606","202.77.162.213","172.16.115.20","TCP","66","47496  >  23 [ACK] Seq=321 Ack=497 Win=33580 Len=0 TSval=186596 TSecr=9212993"
"225","4.242839","172.16.115.20","202.77.162.213","TELNET","72","Telnet Data ..."
"226","4.248755","172.16.115.20","202.77.162.213","TCP","66","23  >  47496 [FIN, ACK] Seq=503 Ack=321 Win=10136 Len=0 TSval=9212996 TSecr=186596"
"227","4.248919","202.77.162.213","172.16.115.20","TCP","66","47496  >  23 [ACK] Seq=321 Ack=504 Win=33574 Len=0 TSval=186596 TSecr=9212995"
"228","4.253364","202.77.162.213","172.16.115.20","TCP","74","1023  >  514 [SYN] Seq=0 Win=32768 Len=0 MSS=1460 WS=1 TSval=186596 TSecr=0"
"229","4.253625","172.16.115.20","202.77.162.213","TCP","74","514  >  1023 [SYN, ACK] Seq=0 Ack=1 Win=10136 Len=0 TSval=9212996 TSecr=186596 WS=1 MSS=1460"
"230","4.253701","202.77.162.213","172.16.115.20","TCP","66","47496  >  23 [FIN, ACK] Seq=321 Ack=504 Win=33574 Len=0 TSval=186596 TSecr=9212995"
"231","4.253774","202.77.162.213","172.16.115.20","TCP","66","1023  >  514 [ACK] Seq=1 Ack=1 Win=33580 Len=0 TSval=186596 TSecr=9212996"
"232","4.253858","172.16.115.20","202.77.162.213","TCP","66","23  >  47496 [ACK] Seq=504 Ack=322 Win=10136 Len=0 TSval=9212996 TSecr=186596"
"233","4.254773","202.77.162.213","172.16.115.20","RSH","71","Session Establishment"
"234","4.254905","172.16.115.20","202.77.162.213","TCP","66","514  >  1023 [ACK] Seq=1 Ack=6 Win=10131 Len=0 TSval=9212997 TSecr=186596"
"235","5.295204","172.16.115.20","202.77.162.213","TCP","60","1021  >  1022 [SYN] Seq=0 Win=8760 Len=0 MSS=1460"
"236","5.295370","202.77.162.213","172.16.115.20","TCP","60","1022  >  1021 [SYN, ACK] Seq=0 Ack=1 Win=33580 Len=0 MSS=1460"
"237","5.295555","172.16.115.20","202.77.162.213","TCP","60","1021  >  1022 [ACK] Seq=1 Ack=1 Win=8760 Len=0"
"238","5.298761","202.77.162.213","172.16.115.20","RSH","71","Session Establishment"
"239","5.298948","172.16.115.20","202.77.162.213","TCP","66","514  >  1023 [ACK] Seq=1 Ack=11 Win=10136 Len=0 TSval=9213101 TSecr=186598"
"240","5.397824","202.77.162.213","172.16.115.20","RSH","99","Session Establishment"
"241","5.416320","172.16.115.20","202.77.162.213","RSH","67","Server username:hacker2 Server -> Client Data"
"242","5.418690","202.77.162.213","172.16.115.20","TCP","66","1023  >  514 [FIN, ACK] Seq=44 Ack=2 Win=33580 Len=0 TSval=186598 TSecr=9213113"
"243","5.418889","172.16.115.20","202.77.162.213","TCP","66","514  >  1023 [ACK] Seq=2 Ack=45 Win=10136 Len=0 TSval=9213113 TSecr=186598"
"244","5.492129","172.16.115.20","202.77.162.213","RSH","99","Server username:hacker2 Server -> Client Data"
"245","5.492270","202.77.162.213","172.16.115.20","TCP","60","1023  >  514 [RST] Seq=45 Win=0 Len=0"
"246","19.265248","202.77.162.213","172.16.112.10","TCP","74","47502  >  23 [SYN] Seq=0 Win=32768 Len=0 MSS=1460 WS=1 TSval=186626 TSecr=0"
"247","19.265594","172.16.112.10","202.77.162.213","TCP","58","23  >  47502 [SYN, ACK] Seq=0 Ack=1 Win=8760 Len=0 MSS=1460"
"248","19.265878","202.77.162.213","172.16.112.10","TCP","60","47502  >  23 [ACK] Seq=1 Ack=1 Win=33580 Len=0"
"249","19.274584","202.77.162.213","172.16.115.20","TCP","74","[TCP Port numbers reused] 1023  >  514 [SYN] Seq=0 Win=32768 Len=0 MSS=1460 WS=1 TSval=186626 TSecr=0"
"250","19.274868","172.16.115.20","202.77.162.213","TCP","74","514  >  1023 [SYN, ACK] Seq=0 Ack=1 Win=10136 Len=0 TSval=9214499 TSecr=186626 WS=1 MSS=1460"
"251","19.275022","202.77.162.213","172.16.115.20","TCP","66","1023  >  514 [ACK] Seq=1 Ack=1 Win=33580 Len=0 TSval=186626 TSecr=9214499"
"252","19.275481","202.77.162.213","172.16.115.20","RSH","71","Session Establishment"
"253","19.275751","172.16.115.20","202.77.162.213","TCP","66","514  >  1023 [ACK] Seq=1 Ack=6 Win=10136 Len=0 TSval=9214499 TSecr=186626"
"254","19.314755","172.16.112.10","202.77.162.213","TELNET","69","Telnet Data ..."
"255","19.317990","202.77.162.213","172.16.112.10","TELNET","69","Telnet Data ..."
"256","19.319453","172.16.112.10","202.77.162.213","TELNET","117","Telnet Data ..."
"257","19.322916","172.16.115.20","202.77.162.213","TCP","60","1020  >  1022 [SYN] Seq=0 Win=8760 Len=0 MSS=1460"
"258","19.323051","202.77.162.213","172.16.115.20","TCP","60","1022  >  1020 [SYN, ACK] Seq=0 Ack=1 Win=33580 Len=0 MSS=1460"
"259","19.323255","172.16.115.20","202.77.162.213","TCP","60","1020  >  1022 [ACK] Seq=1 Ack=1 Win=8760 Len=0"
"260","19.332773","202.77.162.213","172.16.112.10","TCP","60","47502  >  23 [ACK] Seq=16 Ack=79 Win=33580 Len=0"
"261","19.356404","172.16.112.10","202.77.162.213","TELNET","63","Telnet Data ..."
"262","19.359104","202.77.162.213","172.16.112.10","TELNET","63","Telnet Data ..."
"263","19.359177","172.16.112.10","202.77.162.213","TELNET","61","Telnet Data ..."
"264","19.361494","202.77.162.213","172.16.112.10","TELNET","63","Telnet Data ..."
"265","19.361675","172.16.112.10","202.77.162.213","TELNET","57","Telnet Data ..."
"266","19.382764","202.77.162.213","172.16.112.10","TCP","60","47502  >  23 [ACK] Seq=34 Ack=98 Win=33580 Len=0"
"267","19.382849","172.16.112.10","202.77.162.213","TELNET","73","Telnet Data ..."
"268","19.385025","202.77.162.213","172.16.112.10","TELNET","63","Telnet Data ..."
"269","19.385570","172.16.112.10","202.77.162.213","TELNET","56","Telnet Data ..."
"270","19.395605","202.77.162.213","172.16.112.10","TCP","60","47502  >  23 [ACK] Seq=43 Ack=119 Win=33578 Len=0"
"271","19.397113","202.77.162.213","172.16.115.20","RSH","118","Session Establishment"
"272","19.409299","172.16.112.10","202.77.162.213","TELNET","109","Telnet Data ..."
"273","19.415775","172.16.115.20","202.77.162.213","RSH","67","Server username:hacker2 Server -> Client Data"
"274","19.418273","202.77.162.213","172.16.115.20","TCP","66","1023  >  514 [FIN, ACK] Seq=58 Ack=2 Win=33580 Len=0 TSval=186626 TSecr=9214513"
"275","19.418458","172.16.115.20","202.77.162.213","TCP","66","514  >  1023 [ACK] Seq=2 Ack=59 Win=10136 Len=0 TSval=9214513 TSecr=186626"
"276","19.422714","202.77.162.213","172.16.112.10","TCP","60","47502  >  23 [ACK] Seq=43 Ack=174 Win=33580 Len=0"
"277","19.472645","172.16.112.10","202.77.162.213","TELNET","117","Telnet Data ..."
"278","19.480135","172.16.115.20","255.255.255.255","UDP","60","33786  >  9325  Len=9"
"279","19.483234","172.16.115.20","202.77.162.213","RSH","124","Server username:hacker2 Server -> Client Data"
"280","19.483348","202.77.162.213","172.16.115.20","TCP","60","1023  >  514 [RST] Seq=59 Win=0 Len=0"
"281","19.492705","202.77.162.213","172.16.112.10","TCP","60","47502  >  23 [ACK] Seq=43 Ack=237 Win=33580 Len=0"
"282","19.500106","172.16.112.10","202.77.162.213","TELNET","56","Telnet Data ..."
"283","19.503469","202.77.162.213","172.16.112.10","TELNET","75","Telnet Data ..."
"284","19.503758","172.16.112.10","202.77.162.213","TELNET","75","Telnet Data ..."
"285","19.522745","202.77.162.213","172.16.112.10","TCP","60","47502  >  23 [ACK] Seq=64 Ack=260 Win=33580 Len=0"
"286","19.522854","172.16.112.10","202.77.162.213","TELNET","56","Telnet Data ..."
"287","19.527404","202.77.162.213","172.16.112.10","TELNET","72","Telnet Data ..."
"288","19.527687","172.16.112.10","202.77.162.213","TELNET","72","Telnet Data ..."
"289","19.542714","202.77.162.213","172.16.112.10","TCP","60","47502  >  23 [ACK] Seq=82 Ack=280 Win=33580 Len=0"
"290","19.542809","172.16.112.10","202.77.162.213","TELNET","56","Telnet Data ..."
"291","19.547047","202.77.162.213","172.16.112.10","TELNET","135","Telnet Data ..."
"292","19.547564","172.16.112.10","202.77.162.213","TELNET","135","Telnet Data ..."
"293","19.562761","202.77.162.213","172.16.112.10","TCP","60","47502  >  23 [ACK] Seq=163 Ack=363 Win=33580 Len=0"
"294","19.572707","172.16.112.10","202.77.162.213","TCP","58","1023  >  514 [SYN] Seq=0 Win=8760 Len=0 MSS=1460"
"295","19.573042","202.77.162.213","172.16.112.10","TCP","60","514  >  1023 [SYN, ACK] Seq=0 Ack=1 Win=33580 Len=0 MSS=1460"
"296","19.573135","172.16.112.10","202.77.162.213","TCP","54","1023  >  514 [ACK] Seq=1 Ack=1 Win=8760 Len=0"
"297","19.573350","172.16.112.10","202.77.162.213","RSH","55","Session Establishment"
"298","19.595572","202.77.162.213","172.16.112.10","TCP","60","514  >  1023 [ACK] Seq=1 Ack=2 Win=33580 Len=0"
"299","19.595673","172.16.112.10","202.77.162.213","RSH","139","Session Establishment"
"300","19.695077","202.77.162.213","172.16.112.10","RSH","60","Server username:root Server -> Client Data"
"301","19.743642","172.16.112.10","202.77.162.213","TCP","54","1023  >  514 [ACK] Seq=87 Ack=2 Win=8760 Len=0"
"302","19.748686","202.77.162.213","172.16.112.10","RSH","105","Server username:root Server -> Client Data"
"303","19.749007","172.16.112.10","202.77.162.213","TCP","54","1023  >  514 [FIN, ACK] Seq=87 Ack=53 Win=8760 Len=0"
"304","19.749234","202.77.162.213","172.16.112.10","TCP","60","514  >  1023 [FIN, ACK] Seq=53 Ack=87 Win=33580 Len=0"
"305","19.749456","202.77.162.213","172.16.112.10","TCP","60","[TCP Out-Of-Order] 514  >  1023 [FIN, ACK] Seq=53 Ack=88 Win=33580 Len=0"
"306","19.749566","172.16.112.10","202.77.162.213","TCP","54","1023  >  514 [ACK] Seq=88 Ack=54 Win=8760 Len=0"
"307","19.749656","172.16.112.10","202.77.162.213","TCP","54","[TCP Dup ACK 306#1] 1023  >  514 [ACK] Seq=88 Ack=54 Win=8760 Len=0"
"308","19.750776","172.16.112.10","202.77.162.213","TCP","58","1022  >  514 [SYN] Seq=0 Win=8760 Len=0 MSS=1460"
"309","19.751094","202.77.162.213","172.16.112.10","TCP","60","514  >  1022 [SYN, ACK] Seq=0 Ack=1 Win=33580 Len=0 MSS=1460"
"310","19.751182","172.16.112.10","202.77.162.213","TCP","54","1022  >  514 [ACK] Seq=1 Ack=1 Win=8760 Len=0"
"311","19.751376","172.16.112.10","202.77.162.213","RSH","55","Session Establishment"
"312","19.795524","202.77.162.213","172.16.112.10","TCP","60","514  >  1022 [ACK] Seq=1 Ack=2 Win=33580 Len=0"
"313","19.795640","172.16.112.10","202.77.162.213","RSH","125","Session Establishment"
"314","19.983787","172.16.112.10","202.77.162.213","TCP","125","[TCP Retransmission] 1022  >  514 [PSH, ACK] Seq=2 Ack=1 Win=8760 Len=71"
"315","19.984094","202.77.162.213","172.16.112.10","TCP","60","514  >  1022 [ACK] Seq=1 Ack=73 Win=33580 Len=0"
"316","20.863068","202.77.162.213","172.16.112.10","RSH","60","Server username:root Server -> Client Data"
"317","20.863350","172.16.112.10","202.77.162.213","RSH","55","Server username:root Client -> Server data"
"318","20.921786","202.77.162.213","172.16.112.10","RSH","77","Server username:root Server -> Client Data"
"319","20.922501","172.16.112.10","202.77.162.213","RSH","55","Server username:root Client -> Server data"
"320","20.929672","202.77.162.213","172.16.112.10","RSH","1514","Server username:root Server -> Client Data"
"321","20.929724","172.16.112.10","202.77.162.213","TCP","54","1022  >  514 [ACK] Seq=75 Ack=1485 Win=24820 Len=0"
"322","20.930910","202.77.162.213","172.16.112.10","RSH","1514","Server username:root Server -> Client Data"
"323","20.932153","202.77.162.213","172.16.112.10","RSH","1514","Server username:root Server -> Client Data"
"324","20.932203","172.16.112.10","202.77.162.213","TCP","54","1022  >  514 [ACK] Seq=75 Ack=4405 Win=24820 Len=0"
"325","20.933452","202.77.162.213","172.16.112.10","RSH","1514","Server username:root Server -> Client Data"
"326","20.938449","202.77.162.213","172.16.112.10","RSH","1514","Server username:root Server -> Client Data"
"327","20.939755","202.77.162.213","172.16.112.10","RSH","1514","Server username:root Server -> Client Data"
"328","20.939798","172.16.112.10","202.77.162.213","TCP","54","1022  >  514 [ACK] Seq=75 Ack=8785 Win=24820 Len=0"
"329","20.940964","202.77.162.213","172.16.112.10","RSH","1514","Server username:root Server -> Client Data"
"330","20.942282","202.77.162.213","172.16.112.10","RSH","1514","Server username:root Server -> Client Data"
"331","20.943510","202.77.162.213","172.16.112.10","RSH","1514","Server username:root Server -> Client Data"
"332","20.944840","202.77.162.213","172.16.112.10","RSH","1514","Server username:root Server -> Client Data"
"333","20.944908","172.16.112.10","202.77.162.213","TCP","54","1022  >  514 [ACK] Seq=75 Ack=14625 Win=24820 Len=0"
"334","20.947811","202.77.162.213","172.16.112.10","RSH","1514","Server username:root Server -> Client Data"
"335","20.949077","202.77.162.213","172.16.112.10","RSH","1514","Server username:root Server -> Client Data"
"336","20.950317","202.77.162.213","172.16.112.10","RSH","1514","Server username:root Server -> Client Data"
"337","20.953465","202.77.162.213","172.16.112.10","RSH","1514","Server username:root Server -> Client Data"
"338","20.954730","202.77.162.213","172.16.112.10","RSH","1514","Server username:root Server -> Client Data"
"339","20.954840","172.16.112.10","202.77.162.213","TCP","54","1022  >  514 [ACK] Seq=75 Ack=21925 Win=24820 Len=0"
"340","20.956081","202.77.162.213","172.16.112.10","RSH","1514","Server username:root Server -> Client Data"
"341","20.957303","202.77.162.213","172.16.112.10","RSH","1514","Server username:root Server -> Client Data"
"342","20.958628","202.77.162.213","172.16.112.10","RSH","1514","Server username:root Server -> Client Data"
"343","20.960015","202.77.162.213","172.16.112.10","RSH","1514","Server username:root Server -> Client Data"
"344","20.961284","202.77.162.213","172.16.112.10","RSH","1514","Server username:root Server -> Client Data"
"345","20.962548","202.77.162.213","172.16.112.10","RSH","1514","Server username:root Server -> Client Data"
"346","20.962593","172.16.112.10","202.77.162.213","TCP","54","1022  >  514 [ACK] Seq=75 Ack=30685 Win=24820 Len=0"
"347","20.963896","202.77.162.213","172.16.112.10","RSH","1514","Server username:root Server -> Client Data"
"348","20.965109","202.77.162.213","172.16.112.10","RSH","1514","Server username:root Server -> Client Data"
"349","20.966425","202.77.162.213","172.16.112.10","RSH","1514","Server username:root Server -> Client Data"
"350","20.967653","202.77.162.213","172.16.112.10","RSH","1514","Server username:root Server -> Client Data"
"351","20.968936","202.77.162.213","172.16.112.10","RSH","1514","Server username:root Server -> Client Data"
"352","20.970277","202.77.162.213","172.16.112.10","RSH","1514","Server username:root Server -> Client Data"
"353","20.971586","202.77.162.213","172.16.112.10","RSH","1514","Server username:root Server -> Client Data"
"354","20.971631","172.16.112.10","202.77.162.213","TCP","54","1022  >  514 [ACK] Seq=75 Ack=40905 Win=24820 Len=0"
"355","20.972825","202.77.162.213","172.16.112.10","RSH","1514","Server username:root Server -> Client Data"
"356","20.974363","202.77.162.213","172.16.112.10","RSH","1514","Server username:root Server -> Client Data"
"357","21.023991","172.16.112.10","202.77.162.213","TCP","54","1022  >  514 [ACK] Seq=75 Ack=43825 Win=24820 Len=0"
"358","21.024558","202.77.162.213","172.16.112.10","RSH","431","Server username:root Server -> Client Data"
"359","21.024910","172.16.112.10","202.77.162.213","RSH","55","Server username:root Client -> Server data"
"360","21.027232","202.77.162.213","172.16.112.10","TCP","60","514  >  1022 [FIN, ACK] Seq=44202 Ack=76 Win=33580 Len=0"
"361","21.027277","172.16.112.10","202.77.162.213","TCP","54","1022  >  514 [ACK] Seq=76 Ack=44203 Win=24820 Len=0"
"362","21.027573","172.16.112.10","202.77.162.213","TCP","54","1022  >  514 [FIN, ACK] Seq=76 Ack=44203 Win=24820 Len=0"
"363","21.027849","202.77.162.213","172.16.112.10","TCP","60","514  >  1022 [ACK] Seq=44203 Ack=77 Win=33580 Len=0"
"364","21.029824","172.16.112.10","202.77.162.213","TELNET","56","Telnet Data ..."
"365","21.035084","202.77.162.213","172.16.112.10","TELNET","76","Telnet Data ..."
"366","21.035375","172.16.112.10","202.77.162.213","TELNET","76","Telnet Data ..."
"367","21.052869","202.77.162.213","172.16.112.10","TCP","60","47502  >  23 [ACK] Seq=185 Ack=387 Win=33580 Len=0"
"368","21.052944","172.16.112.10","202.77.162.213","TELNET","56","Telnet Data ..."
"369","21.056976","202.77.162.213","172.16.112.10","TELNET","81","Telnet Data ..."
"370","21.057255","172.16.112.10","202.77.162.213","TELNET","81","Telnet Data ..."
"371","21.061423","202.77.162.213","172.16.112.10","TELNET","60","Telnet Data ..."
"372","21.061584","172.16.112.10","202.77.162.213","TELNET","56","Telnet Data ..."
"373","21.082901","202.77.162.213","172.16.112.10","TCP","60","47502  >  23 [ACK] Seq=218 Ack=418 Win=33580 Len=0"
"374","21.082983","172.16.112.10","202.77.162.213","TELNET","60","Telnet Data ..."
"375","21.083262","202.77.162.213","172.16.112.10","TCP","60","47502  >  23 [ACK] Seq=218 Ack=425 Win=33574 Len=0"
"376","21.083919","202.77.162.213","172.16.112.10","TCP","60","47502  >  23 [FIN, ACK] Seq=218 Ack=425 Win=33574 Len=0"
"377","21.083971","172.16.112.10","202.77.162.213","TCP","54","23  >  47502 [ACK] Seq=425 Ack=219 Win=8760 Len=0"
"378","36.095421","202.77.162.213","172.16.112.50","TCP","74","47512  >  23 [SYN] Seq=0 Win=32768 Len=0 MSS=1460 WS=1 TSval=186660 TSecr=0"
"379","36.095720","172.16.112.50","202.77.162.213","TCP","60","23  >  47512 [SYN, ACK] Seq=0 Ack=1 Win=8760 Len=0 MSS=1460"
"380","36.095871","202.77.162.213","172.16.112.50","TCP","60","47512  >  23 [ACK] Seq=1 Ack=1 Win=33580 Len=0"
"381","36.109156","202.77.162.213","172.16.112.10","TCP","74","1023  >  514 [SYN] Seq=0 Win=32768 Len=0 MSS=1460 WS=1 TSval=186660 TSecr=0"
"382","36.109401","172.16.112.10","202.77.162.213","TCP","58","514  >  1023 [SYN, ACK] Seq=0 Ack=1 Win=8760 Len=0 MSS=1460"
"383","36.109670","202.77.162.213","172.16.112.10","TCP","60","1023  >  514 [ACK] Seq=1 Ack=1 Win=33580 Len=0"
"384","36.110295","202.77.162.213","172.16.112.10","RSH","60","Session Establishment"
"385","36.142589","172.16.112.10","202.77.162.213","TCP","58","1022  >  1022 [SYN] Seq=0 Win=8760 Len=0 MSS=1460"
"386","36.142906","202.77.162.213","172.16.112.10","TCP","60","1022  >  1022 [SYN, ACK] Seq=0 Ack=1 Win=33580 Len=0 MSS=1460"
"387","36.142993","172.16.112.10","202.77.162.213","TCP","54","1022  >  1022 [ACK] Seq=1 Ack=1 Win=8760 Len=0"
"388","36.157133","172.16.112.10","202.77.162.213","TCP","54","514  >  1023 [ACK] Seq=1 Ack=6 Win=8760 Len=0"
"389","36.173773","172.16.112.50","202.77.162.213","TELNET","69","Telnet Data ..."
"390","36.177061","202.77.162.213","172.16.112.50","TELNET","69","Telnet Data ..."
"391","36.179705","172.16.112.50","202.77.162.213","TELNET","118","Telnet Data ..."
"392","36.192963","202.77.162.213","172.16.112.50","TCP","60","47512  >  23 [ACK] Seq=16 Ack=80 Win=33580 Len=0"
"393","36.196231","202.77.162.213","172.16.112.10","RSH","106","Session Establishment"
"394","36.211663","172.16.112.10","202.77.162.213","RSH","55","Server username:hacker2 Server -> Client Data"
"395","36.214362","202.77.162.213","172.16.112.10","TCP","60","1023  >  514 [FIN, ACK] Seq=58 Ack=2 Win=33580 Len=0"
"396","36.214430","172.16.112.10","202.77.162.213","TCP","54","514  >  1023 [ACK] Seq=2 Ack=59 Win=8760 Len=0"
"397","36.229031","172.16.112.50","202.77.162.213","TELNET","63","Telnet Data ..."
"398","36.231719","202.77.162.213","172.16.112.50","TELNET","63","Telnet Data ..."
"399","36.231923","172.16.112.50","202.77.162.213","TELNET","61","Telnet Data ..."
"400","36.234185","202.77.162.213","172.16.112.50","TELNET","63","Telnet Data ..."
"401","36.234353","172.16.112.50","202.77.162.213","TELNET","60","Telnet Data ..."
"402","36.252948","202.77.162.213","172.16.112.50","TCP","60","47512  >  23 [ACK] Seq=34 Ack=99 Win=33580 Len=0"
"403","36.253131","172.16.112.50","202.77.162.213","TELNET","73","Telnet Data ..."
"404","36.255171","202.77.162.213","172.16.112.50","TELNET","63","Telnet Data ..."
"405","36.255927","172.16.112.50","202.77.162.213","TELNET","60","Telnet Data ..."
"406","36.258204","172.16.112.10","255.255.255.255","UDP","51","32826  >  9325  Len=9"
"407","36.259048","172.16.112.10","202.77.162.213","RSH","112","Server username:hacker2 Server -> Client Data"
"408","36.259568","202.77.162.213","172.16.112.10","TCP","60","1023  >  514 [RST] Seq=59 Win=0 Len=0"
"409","36.272927","202.77.162.213","172.16.112.50","TCP","60","47512  >  23 [ACK] Seq=43 Ack=120 Win=33580 Len=0"
"410","36.317023","172.16.112.50","202.77.162.213","TELNET","109","Telnet Data ..."
"411","36.332912","202.77.162.213","172.16.112.50","TCP","60","47512  >  23 [ACK] Seq=43 Ack=175 Win=33580 Len=0"
"412","36.418861","172.16.112.50","202.77.162.213","TELNET","1192","Telnet Data ..."
"413","36.442892","202.77.162.213","172.16.112.50","TCP","60","47512  >  23 [ACK] Seq=43 Ack=1313 Win=33580 Len=0"
"414","36.452479","172.16.112.50","202.77.162.213","TELNET","62","Telnet Data ..."
"415","36.456410","202.77.162.213","172.16.112.50","TELNET","75","Telnet Data ..."
"416","36.456801","172.16.112.50","202.77.162.213","TELNET","75","Telnet Data ..."
"417","36.472870","202.77.162.213","172.16.112.50","TCP","60","47512  >  23 [ACK] Seq=64 Ack=1342 Win=33580 Len=0"
"418","36.475098","172.16.112.50","202.77.162.213","TELNET","62","Telnet Data ..."
"419","36.479550","202.77.162.213","172.16.112.50","TELNET","72","Telnet Data ..."
"420","36.479910","172.16.112.50","202.77.162.213","TELNET","72","Telnet Data ..."
"421","36.492889","202.77.162.213","172.16.112.50","TCP","60","47512  >  23 [ACK] Seq=82 Ack=1368 Win=33580 Len=0"
"422","36.493057","172.16.112.50","202.77.162.213","TELNET","62","Telnet Data ..."
"423","36.497230","202.77.162.213","172.16.112.50","TELNET","135","Telnet Data ..."
"424","36.497849","172.16.112.50","202.77.162.213","TELNET","135","Telnet Data ..."
"425","36.512866","202.77.162.213","172.16.112.50","TCP","60","47512  >  23 [ACK] Seq=163 Ack=1457 Win=33580 Len=0"
"426","36.529543","172.16.112.50","202.77.162.213","TCP","60","1023  >  514 [SYN] Seq=0 Win=8760 Len=0 MSS=1460"
"427","36.529710","202.77.162.213","172.16.112.50","TCP","60","514  >  1023 [SYN, ACK] Seq=0 Ack=1 Win=33580 Len=0 MSS=1460"
"428","36.529953","172.16.112.50","202.77.162.213","TCP","60","1023  >  514 [ACK] Seq=1 Ack=1 Win=8760 Len=0"
"429","36.530144","172.16.112.50","202.77.162.213","RSH","60","Session Establishment"
"430","36.594511","202.77.162.213","172.16.112.50","TCP","60","514  >  1023 [ACK] Seq=1 Ack=2 Win=33580 Len=0"
"431","36.594715","172.16.112.50","202.77.162.213","RSH","139","Session Establishment"
"432","36.674636","202.77.162.213","172.16.112.50","RSH","60","Server username:root Server -> Client Data"
"433","36.706565","202.77.162.213","172.16.112.50","RSH","105","Server username:root Server -> Client Data"
"434","36.706725","172.16.112.50","202.77.162.213","TCP","60","1023  >  514 [ACK] Seq=87 Ack=54 Win=8760 Len=0"
"435","36.707055","172.16.112.50","202.77.162.213","TCP","60","1023  >  514 [FIN, ACK] Seq=87 Ack=54 Win=8760 Len=0"
"436","36.707181","202.77.162.213","172.16.112.50","TCP","60","514  >  1023 [ACK] Seq=54 Ack=88 Win=33580 Len=0"
"437","36.709048","172.16.112.50","202.77.162.213","TCP","60","[TCP Port numbers reused] 1023  >  514 [SYN] Seq=0 Win=8760 Len=0 MSS=1460"
"438","36.709198","202.77.162.213","172.16.112.50","TCP","60","514  >  1023 [SYN, ACK] Seq=0 Ack=1 Win=33580 Len=0 MSS=1460"
"439","36.709372","172.16.112.50","202.77.162.213","TCP","60","1023  >  514 [ACK] Seq=1 Ack=1 Win=8760 Len=0"
"440","36.709524","172.16.112.50","202.77.162.213","RSH","60","Session Establishment"
"441","36.794461","202.77.162.213","172.16.112.50","TCP","60","514  >  1023 [ACK] Seq=1 Ack=2 Win=33580 Len=0"
"442","36.794662","172.16.112.50","202.77.162.213","RSH","125","Session Establishment"
"443","36.874935","202.77.162.213","172.16.112.50","RSH","60","Server username:root Server -> Client Data"
"444","36.875335","172.16.112.50","202.77.162.213","RSH","60","Server username:root Client -> Server data"
"445","36.934000","202.77.162.213","172.16.112.50","RSH","77","Server username:root Server -> Client Data"
"446","36.935030","172.16.112.50","202.77.162.213","RSH","60","Server username:root Client -> Server data"
"447","36.942102","202.77.162.213","172.16.112.50","RSH","1514","Server username:root Server -> Client Data"
"448","36.943373","202.77.162.213","172.16.112.50","RSH","1514","Server username:root Server -> Client Data"
"449","36.944596","202.77.162.213","172.16.112.50","RSH","1514","Server username:root Server -> Client Data"
"450","36.944673","172.16.112.50","202.77.162.213","TCP","60","1023  >  514 [ACK] Seq=75 Ack=1485 Win=24820 Len=0"
"451","36.944799","172.16.112.50","202.77.162.213","TCP","60","1023  >  514 [ACK] Seq=75 Ack=4405 Win=24820 Len=0"
"452","36.946033","202.77.162.213","172.16.112.50","RSH","1514","Server username:root Server -> Client Data"
"453","36.951020","202.77.162.213","172.16.112.50","RSH","1514","Server username:root Server -> Client Data"
"454","36.952308","202.77.162.213","172.16.112.50","RSH","1514","Server username:root Server -> Client Data"
"455","36.953553","202.77.162.213","172.16.112.50","RSH","1514","Server username:root Server -> Client Data"
"456","36.953620","172.16.112.50","202.77.162.213","TCP","60","1023  >  514 [ACK] Seq=75 Ack=8785 Win=24820 Len=0"
"457","36.954856","202.77.162.213","172.16.112.50","RSH","1514","Server username:root Server -> Client Data"
"458","36.956088","202.77.162.213","172.16.112.50","RSH","1514","Server username:root Server -> Client Data"
"459","36.957532","202.77.162.213","172.16.112.50","RSH","1514","Server username:root Server -> Client Data"
"460","36.957720","172.16.112.50","202.77.162.213","TCP","60","1023  >  514 [ACK] Seq=75 Ack=14625 Win=24820 Len=0"
"461","36.960401","202.77.162.213","172.16.112.50","RSH","1514","Server username:root Server -> Client Data"
"462","36.961774","202.77.162.213","172.16.112.50","RSH","1514","Server username:root Server -> Client Data"
"463","36.962994","202.77.162.213","172.16.112.50","RSH","1514","Server username:root Server -> Client Data"
"464","36.964300","202.77.162.213","172.16.112.50","RSH","1514","Server username:root Server -> Client Data"
"465","36.965530","202.77.162.213","172.16.112.50","RSH","1514","Server username:root Server -> Client Data"
"466","36.965718","172.16.112.50","202.77.162.213","TCP","60","1023  >  514 [ACK] Seq=75 Ack=21925 Win=24820 Len=0"
"467","36.967002","202.77.162.213","172.16.112.50","RSH","1514","Server username:root Server -> Client Data"
"468","36.968919","202.77.162.213","172.16.112.50","RSH","1514","Server username:root Server -> Client Data"
"469","36.970177","202.77.162.213","172.16.112.50","RSH","1514","Server username:root Server -> Client Data"
"470","36.971409","202.77.162.213","172.16.112.50","RSH","1514","Server username:root Server -> Client Data"
"471","36.972777","202.77.162.213","172.16.112.50","RSH","1514","Server username:root Server -> Client Data"
"472","36.974187","202.77.162.213","172.16.112.50","RSH","1514","Server username:root Server -> Client Data"
"473","36.975488","202.77.162.213","172.16.112.50","RSH","1514","Server username:root Server -> Client Data"
"474","36.976715","202.77.162.213","172.16.112.50","RSH","1514","Server username:root Server -> Client Data"
"475","36.976797","172.16.112.50","202.77.162.213","TCP","60","1023  >  514 [ACK] Seq=75 Ack=30685 Win=24820 Len=0"
"476","36.978033","202.77.162.213","172.16.112.50","RSH","1514","Server username:root Server -> Client Data"
"477","36.979263","202.77.162.213","172.16.112.50","RSH","1514","Server username:root Server -> Client Data"
"478","36.983850","202.77.162.213","172.16.112.50","RSH","1514","Server username:root Server -> Client Data"
"479","36.985141","202.77.162.213","172.16.112.50","RSH","1514","Server username:root Server -> Client Data"
"480","36.986483","202.77.162.213","172.16.112.50","RSH","1514","Server username:root Server -> Client Data"
"481","36.987719","202.77.162.213","172.16.112.50","RSH","1514","Server username:root Server -> Client Data"
"482","36.987796","172.16.112.50","202.77.162.213","TCP","60","1023  >  514 [ACK] Seq=75 Ack=40905 Win=24820 Len=0"
"483","36.989065","202.77.162.213","172.16.112.50","RSH","1514","Server username:root Server -> Client Data"
"484","37.033403","172.16.112.50","202.77.162.213","TCP","60","1023  >  514 [ACK] Seq=75 Ack=43825 Win=24820 Len=0"
"485","37.033836","202.77.162.213","172.16.112.50","RSH","431","Server username:root Server -> Client Data"
"486","37.034375","172.16.112.50","202.77.162.213","RSH","60","Server username:root Client -> Server data"
"487","37.036534","202.77.162.213","172.16.112.50","TCP","60","514  >  1023 [FIN, ACK] Seq=44202 Ack=76 Win=33580 Len=0"
"488","37.036678","172.16.112.50","202.77.162.213","TCP","60","1023  >  514 [ACK] Seq=76 Ack=44203 Win=24820 Len=0"
"489","37.037028","172.16.112.50","202.77.162.213","TCP","60","1023  >  514 [FIN, ACK] Seq=76 Ack=44203 Win=24820 Len=0"
"490","37.037150","202.77.162.213","172.16.112.50","TCP","60","514  >  1023 [ACK] Seq=44203 Ack=77 Win=33580 Len=0"
"491","37.039776","172.16.112.50","202.77.162.213","TELNET","62","Telnet Data ..."
"492","37.044873","202.77.162.213","172.16.112.50","TELNET","76","Telnet Data ..."
"493","37.045248","172.16.112.50","202.77.162.213","TELNET","76","Telnet Data ..."
"494","37.062957","202.77.162.213","172.16.112.50","TCP","60","47512  >  23 [ACK] Seq=185 Ack=1487 Win=33580 Len=0"
"495","37.063509","172.16.112.50","202.77.162.213","TELNET","62","Telnet Data ..."
"496","37.067414","202.77.162.213","172.16.112.50","TELNET","81","Telnet Data ..."
"497","37.067789","172.16.112.50","202.77.162.213","TELNET","81","Telnet Data ..."
"498","37.071727","202.77.162.213","172.16.112.50","TELNET","60","Telnet Data ..."
"499","37.071923","172.16.112.50","202.77.162.213","TELNET","62","Telnet Data ..."
"500","37.092968","202.77.162.213","172.16.112.50","TCP","60","47512  >  23 [ACK] Seq=218 Ack=1530 Win=33580 Len=0"
"501","37.093172","172.16.112.50","202.77.162.213","TELNET","60","Telnet Data ..."
"502","37.095784","172.16.112.50","202.77.162.213","TCP","60","23  >  47512 [FIN, ACK] Seq=1536 Ack=218 Win=8760 Len=0"
"503","37.095917","202.77.162.213","172.16.112.50","TCP","60","47512  >  23 [ACK] Seq=218 Ack=1537 Win=33574 Len=0"
"504","37.096527","202.77.162.213","172.16.112.50","TCP","60","47512  >  23 [FIN, ACK] Seq=218 Ack=1537 Win=33574 Len=0"
"505","37.096691","172.16.112.50","202.77.162.213","TCP","60","23  >  47512 [ACK] Seq=1537 Ack=219 Win=8760 Len=0"
"506","52.112350","202.77.162.213","172.16.112.50","TCP","74","1023  >  514 [SYN] Seq=0 Win=32768 Len=0 MSS=1460 WS=1 TSval=186692 TSecr=0"
"507","52.112629","172.16.112.50","202.77.162.213","TCP","60","514  >  1023 [SYN, ACK] Seq=0 Ack=1 Win=8760 Len=0 MSS=1460"
"508","52.112781","202.77.162.213","172.16.112.50","TCP","60","1023  >  514 [ACK] Seq=1 Ack=1 Win=33580 Len=0"
"509","52.113210","202.77.162.213","172.16.112.50","RSH","60","Session Establishment"
"510","52.155461","172.16.112.50","202.77.162.213","TCP","60","514  >  1023 [ACK] Seq=1 Ack=6 Win=8760 Len=0"
"511","52.172128","172.16.112.50","202.77.162.213","TCP","60","1023  >  1022 [SYN] Seq=0 Win=8760 Len=0 MSS=1460"
"512","52.172316","202.77.162.213","172.16.112.50","TCP","60","1022  >  1023 [SYN, ACK] Seq=0 Ack=1 Win=33580 Len=0 MSS=1460"
"513","52.172511","172.16.112.50","202.77.162.213","TCP","60","1023  >  1022 [ACK] Seq=1 Ack=1 Win=8760 Len=0"
"514","52.195273","202.77.162.213","172.16.112.50","RSH","106","Session Establishment"
"515","52.220889","172.16.112.50","202.77.162.213","RSH","60","Server username:hacker2 Server -> Client Data"
"516","52.223366","202.77.162.213","172.16.112.50","TCP","60","1023  >  514 [FIN, ACK] Seq=58 Ack=2 Win=33580 Len=0"
"517","52.223545","172.16.112.50","202.77.162.213","TCP","60","514  >  1023 [ACK] Seq=2 Ack=59 Win=8760 Len=0"
"518","52.298664","172.16.112.50","255.255.255.255","UDP","60","34459  >  9325  Len=9"
"519","52.299584","172.16.112.50","202.77.162.213","RSH","112","Server username:hacker2 Server -> Client Data"
"520","52.299711","202.77.162.213","172.16.112.50","TCP","60","1023  >  514 [RST] Seq=59 Win=0 Len=0"
